text,entity,entity_tag,entity_pos_start_rel,entity_pos_end_rel,category
"23 январь 2020 год время визит израиль владимир путин встретиться мать девушка яффа иссахар , который также попросить помилование дочь .",владимир путин,PERSON,46,60,1
трамп отменить соглашение обама нормализация отношение сша куба,сша,COUNTRY,57,60,1
чулпан хаматовый сыграть главный роль фильм доктор лиза,лиза,PERSON,58,62,1
"частность , бывший министр здравоохранение клод эвино , участвовать разработка , подвергнуть редактирование изображение сартр тать критика , назвать « абсурд » .",тать,PERSON,131,135,1
"кеплена вспоминать , ход следствие несколько нестыковка пытаться выяснить правда …",кеплена,PERSON,0,6,1
"всё - таки пройти знамя соцсеть facebook , основатель который марк цукерберг стать человек год версия влиятельный американский журнал time .",time,ORGANIZATION,149,153,1
"российский сборная очередной , 28 - й стать победительница общекомандный зачёт чемпионат мир самбо .",российский сборная,ORGANIZATION,0,18,1
"2018 год премьер - министр эфиопия президент эритрея исайясти афеверка заключить мирный договор договориться сотрудничать несколько сфера , число экономический .",премьер - министр эфиопия,PROFESSION,12,35,1
"ещё , выступать звезда современный футбол дидье дрогб , саломон кал , коло тур , яя тур .",саломон кал,PERSON,81,93,1
"марчевский призвать пускать « оно » отечественный прокат : « должный охранять наш святыня , наш культура , число символ радость — клоун цирк » .",клоун,PROFESSION,142,149,1
керри сыграть также видный роль восстановление дипломатический отношение сша вьетнам .,керри,PERSON,0,5,1
"кэбла указать , обратиться просьба введение аналогичный контроль страна евросоюз .",евросоюз,ORGANIZATION,90,99,1
"спикер национальный ассамблея диосдадый кабельо прочесть письмо законодатель , который заявить , врач рекомендовать чавес отправляться пока домой .",чавес,PERSON,120,126,1
"тони сопрано любить свой жена кармела , заботливый отец , время поддерживать несколько внебрачный связь .",тони сопрано,PERSON,0,12,1
"канадский морской офицер , который признаться , сотрудничать российский спецслужба течение 4 год , приговорить 20 год тюрьма .",российский спецслужба,ORGANIZATION,69,93,1
"сша указывать , действовать ведомо вовлечь страна .",сша,COUNTRY,0,3,1
наслать огнестрельный оружие заготовить заявление клятва верность иго слово « здравствовать исламский государство » .,иго,ORGANIZATION,79,81,1
"фолл неоднократно писать заявление полиция повод , макафи часто стрелять свой ружьё , также - агрессивный поведение собака .",полиция,ORGANIZATION,36,43,1
друг аркановый скорбеть потеря приносить соболезнование родный .,аркановый,PERSON,7,15,1
"богородица выполнить обещание : год война , председатель командовать партизанский обряд , попасть плен , расстрелять остаться живой , чудом .",богородица,PERSON,2,12,1
"2018 год премьер - министр эфиопия президент эритрея исайясти афеверка заключить мирный договор договориться сотрудничать несколько сфера , число экономический .",исайясти афеверка,PERSON,56,71,1
"кроме майкл мур , проект мочь принять участие известный режиссёр , стивен гэгать , джон камерон митчел , роланд эммерих , снять фильм - катастрофа « 2012 » , создатель картина « социальный сеть » аарон соркина девид финчер .",режиссёр,PROFESSION,68,77,1
"17 % поддерживать вариант технический правительство руснок , 21 % приемлемый продолжение коалиционный кабинет osd - top 09 премьер мирослава немцов .",коалиционный кабинет,ORGANIZATION,91,113,1
"западный сми сообщать , число пять основный фаворит гонка находиться , частность , бывший премьер ибрахим бубакар кейт ( ibrahim boubacar keita ) .",ибрахим бубакар кейт,PERSON,104,125,1
"владимир квачковы — полковник гру отставка , воин - интернационалист , кавалер орден мужество , орден красный звезда награда .",владимир квачковы,PERSON,0,16,1
власть парагвай объявить трёхдневный траур связь гибель политика .,политика,PROFESSION,61,69,1
— намерить будущее поощрять посещение израильтянин новый зеландия помощь недавно подписать договор право работа страна израильский турист » .,новый зеландия,COUNTRY,59,73,1
"« погибнуть мученический смерть , защищать республика » , — заявить лидер всеобщий народный конгресс файк аль - саид , обвинить убийство салех мятежник - хути ( хусит — шиитский повстанец ) .",салех,PERSON,133,139,1
иисус христос потребовать свобода pussy riot новый эпизод « южный парк » ( смотреть ),иисус христос,PERSON,0,13,1
"прекрасный передача партнёр , разрезать российский оборона надвое , чешский нападать вацлав пиларжа выйти малафеев труд сократить отставание свой команда россиянин — 2 : 1 .",вацлав пиларжа,PERSON,94,107,1
"адвокат заявить агентство reuters , оспаривать выдвинуть обвинение искать возможный нарушение арест смилянец 2012 год нидерланды .",смилянец,PERSON,121,129,1
робеть филлипос — приятель джохар царнаева — выпустить залог 100 тысяча доллар .,джохар царнаева,PERSON,26,42,1
"« хезболл » выразить поддержка руководство народ сирия , заявить , « умма стать сильный » .",сирия,COUNTRY,51,56,1
сразу бой александр усик сказать журналист :,александр усик,PERSON,16,30,1
забитый гол россиянин ещё большой активизироваться девять минута удвоить свой преимущество .,россиянин,NATIONALITY,20,28,1
"« балогодарённый палата представитель штат массачусетс принятие резолюция , поддерживать независимость арцах .",палата представитель штат массачусетс,ORGANIZATION,13,52,1
"гран - получить вокалистка вероника карнаухов , школа учиться , — 11 ноутбук компьютерный класс .",вероника карнаухов,PERSON,29,48,1
административный суд кёльн снять последний альбом немецкий индастриал - метать группа rammstein « liebe ist f r alle da » всё ограничение реализация .,rammstein,ORGANIZATION,87,96,1
"решить просить российский гражданство , покинуть страна , который стать иной , кладбище животное » ' ' , — заявить актриса .",российский,COUNTRY,17,28,1
"заявление британский правительство говориться , оценка национальный центр кибербезопасность ( ncsc ) , кибератака « наверняка » провести гру .",национальный центр кибербезопасность,ORGANIZATION,63,101,1
"заявка сборная россия руководство владимир кузюткина попасть связующий вера улякина евгений старцев , нападать леся махно , любовь соколов , наталья гончаров , ольга фатеев , екатерина гамов татьяна кошелев , блокировать мария борисенко ( капитан команда ) , мария перепёлкин , елена константинов юлия меркулов либеро светлана крючков екатерина кабешов .",екатерина кабешов,PERSON,358,376,1
"заявить председатель норвежский нобелевский комитет берита рейсс - андерсен пятница , 5 октябрь 2018 год , муквега мурад « внести важный вклад привлечение внимание военный преступление борьба » .",муквега,PERSON,112,119,1
"пиотровский занимать активный социальный позиция , участвовать общественный дело русский культурный центр , свой действие искренне сожалеть , акт вандализм произойти случайно , эмоция .",русский культурный центр,ORGANIZATION,81,108,1
— намерить будущее поощрять посещение израильтянин новый зеландия помощь недавно подписать договор право работа страна израильский турист » .,израильтянин,NATIONALITY,45,58,1
ранний возраст браудёр активно работать пересечение технология право человек .,браудёр,PERSON,19,26,1
"адвокат заявить агентство reuters , оспаривать выдвинуть обвинение искать возможный нарушение арест смилянец 2012 год нидерланды .",адвокат,PROFESSION,4,11,1
выступление легендарный рокер пройти магазин дом культура ( мм дк ) .,рокер,PROFESSION,25,31,1
"качество условие освобождение гражданин сша боевик выдвинуть ряд требование , среди который освобождение весь заключить гуантанамо секретный американский тюрьма , освобождение родственник усама бин ладен , также освобождение , арестовать подозрение принадлежность движение « аль - кайд » талибан .",усама бин ладен,PERSON,210,226,1
"отмечаться заявление , который выступить пресс - секретарь внешнеполитический ведомство морган ортагус , собеседник подтвердить общий приверженность сша словения – союзник нато , который объединять также двусторонний партнёрский отношение , – дело обеспечение глобальный безопасность .",словения,COUNTRY,161,169,1
"ядерный программа иран , уверенный президент венесуэла , носить мирный характер .",президент венесуэла,PROFESSION,32,51,1
"менее результат совещание сурков заверить путин , правительство совместно администрация президент сделать всё необходимый устранение недостаток сфера .",администрация президент,ORGANIZATION,91,116,1
"сегодня « голос америка » вещать 2500 телевизионный радиоканал весь мир , также предоставлять контент мобильный устройство взаимодействовать аудитория соцсеть .",голос америка,ORGANIZATION,9,22,1
"провальный первый 10 - минутка матч , течение который грек создать вратарский малафеев несколько - настоящий опасный момент , россиянин разбегаться фактически контролировать ход первый тайм .",россиянин,NATIONALITY,140,148,1
"год назад защита опальный башкирский чиновник открыто выступить "" единый россия "" , восстановить господин хабиров партия ( поздний господин хабир пригласить работа кремль ) .",хабир,PERSON,145,152,1
25 июль 2016 год крупный телекоммуникационный компания сша verizon communications официально объявить покупка основный бизнес крупный мировой портал yahoo !,yahoo !,ORGANIZATION,185,191,1
"разговаривать мобильный телефон завод , марк , рабочий цех окончательный обработка vestas , предпочесть разглашать свой фамилия , опасаться репрессия сторона руководство , назвать атмосфера « дело хороший » .",vestas,ORGANIZATION,92,98,1
"столкновение хути сила салех начаться прошлый неделя , обвинить мятежник нападение гигантский мечеть сан племянник — влиятельный командир сила специальный назначение тарек салех .",тарек салех,PERSON,213,226,1
сша талибан обсудить путь снижение насилие афганистан,сша,COUNTRY,0,3,1
"президент выразить уверенность , кандидатура керри быстро утвердить сенат отметить , ' ' « жизненный опыт керри подготовить новый роль » ' ' .",керри,PERSON,47,52,1
"временный премьер мали 1991 1992 год сумана сакко ( soumana sacko ) , сообщение сми , иметь шанс успех .",сумана сакко,PERSON,43,55,1
"заявка сборная россия руководство владимир кузюткина попасть связующий вера улякина евгений старцев , нападать леся махно , любовь соколов , наталья гончаров , ольга фатеев , екатерина гамов татьяна кошелев , блокировать мария борисенко ( капитан команда ) , мария перепёлкин , елена константинов юлия меркулов либеро светлана крючков екатерина кабешов .",екатерина гамов,PERSON,185,201,1
"это успеть поработать известный it - компания , sun novell , однако больший заслуга добиться именно пост руководитель google .",novell,ORGANIZATION,71,77,1
""" специалист калибр , тодда , искать течение год , - заявить .",тодда,PERSON,33,37,1
строить новый норвегия — норвегия 22 июль .,норвегия,COUNTRY,43,51,1
"слово , предлагать матус , табачный компания - прежний смочь использовать фотография сартр , продавать сигарета , кинокомпания музей смочь использовать изображение курящий философ пропаганда фильм выставка .",сартр,PERSON,99,105,1
"бой матиас сказать : « верить , максим всё , классный боец настоящий воин .",максим,PERSON,38,46,1
"метцнер представлять интерес роман абрамович , полиция заинтересоваться история приобретение последний замок кроэ лазурный берег .",метцнер,PERSON,0,7,1
"напрямую фамилия пострадать упоминаться , однако контекст понятно , это дочь фёдор емельяненко , автор статья ева меркачёв свой микроблог twitter также указать , речь идти дочь .",фёдор емельяненко,PERSON,88,106,1
"объявить , президент франция прибыть вашингтон , обсудить глава администрация сша ряд насущный проблема , главное место среди который занимать состояние мировой экономика безопасность .",президент франция,PROFESSION,20,37,1
"слово , президент , полномочие который истекать год , стремиться помочь свой человек занять достойный место чиновничий иерархия - , помочь ранее экс - глава мвд башкирия рафаил диваева , который отставка федеральный министерство республика назначить вица - премьер .",рафаил диваева,PERSON,193,208,1
"президент ( сша барак обама - викиновость ) считать канцлер меркель очень эффективный партнёр число , мочь определить интерес свой страна , поставить первый место , самый время , мочь работать дух сотрудничество вопрос , который интерес страна .",меркель,PERSON,59,66,1
"это первый случай , сирийский армия обстрелять предполагать повстанец ливана , который стараться соблюдать нейтралитет гражданский война сирия .",ливана,COUNTRY,84,90,1
начать сборная россия продемонстрировать отменный настрой игра заметный невооружённый глаз превосходство класс .,сборная россия,ORGANIZATION,15,29,1
"хороший голеадор canucks стать даниэль седина восемь гол , абсолютно понятно — являться хороший бомбардир нынешний нхл .",даниэль седина,PERSON,35,48,1
"знаковый рок - культура событие , который непосредственно связать имя сергей , стать рок - фестиваль « подольск - 87 » , современный группа « алиби » стать сенсация , также процесс , который привести тюремный заключение участник группа « воскресение » алексей романов звукоинженер александр арутюнов .",алиби,ORGANIZATION,148,153,1
"несмотря озвучить тема смерть , разговор « последний - альбом русский рок » , « последний сражение тьма » определение « недобитый романтик » « моральный беспокойство » музыка демидов создавать позитивный творческий , романтичный интеллектуальный атмосфера .",демидов,PERSON,190,198,1
"глава правящий египет высокий совет вооружённый сила маршал хусейн тантави поручить бывший премьер - министр камаль аль - ганзурь сформировать новый кабинет министр , сообщить спутниковый телеканал "" аль - джазира "" .",камаль аль - ганзурь,PERSON,111,129,1
"письмо кроме россия саудовский аравия подписать оман , кувейт , катар , объединить арабский эмират , бахрейн , сирия , пакистан , северный корея , венесуэла , куба , беларусь , мьянма , филиппина множество африканский государство .",россия,COUNTRY,13,19,1
"1979 год рокфеллер оказаться замешать международный скандал , вместе свой давний друг генри киссинджер помочь убедить президент джимми картер позволить иранский шах приехать сша лечение лимфома , стать предпосылка кризис захват заложник иран .",рокфеллер,PERSON,12,21,1
"женский финал открытый чемпионат сша теннис завершиться чистый победа австралийский теннисистка саманта стосура американка серена уильямс , который считаться фаворитка соревнование .",саманта стосура,PERSON,102,116,1
"канцлер германия ангела меркель предупредить москва , европа мочь нанести « огромный экономический политический ущерб » россия , ситуация украинский крым продолжить обостряться .",украинский,COUNTRY,148,158,1
барак обама принимать белый дом свой французский коллега николя саркози .,барак обама,PERSON,0,11,1
"дарио фо ( , 24 март 1926 год , санджано , италия ) — итальянский драматург , режиссёр , теоретик сценический мастерство , живописец .",дарио фо,PERSON,0,8,1
"мадурый , пользоваться поддержка китай россия , закрыть граница американский помощь , принять помощь красный крест .",мадурый,PERSON,0,6,1
"компания добавить , « ' ' tiktok стремиться ответственный лицо сша , включать работа сенат регулировать орган ' ' » .",tiktok,ORGANIZATION,28,34,1
