text,entity,entity_tag,entity_pos_start_rel,entity_pos_end_rel,category
проект участвовать рэп исполнитель видеооператор карина куча звукорежиссёр ксения абрамов роль алиенисткать ярослав клапрус роль молодой девушка жертва,звукорежиссёр,PROFESSION,64,77,0
"канал грибоедов , вид сторона спас кровь",грибоедов,PERSON,6,16,0
"жюри премия состоять литературовед , критик , представитель роспечать , московский государственный университет печать художник - иллюстратор .",критик,PROFESSION,40,48,0
"скульптура давид , изображать соперник голиаф библейский сюжет , создать итальянский художник микеланджело буонарротить 1501 — 1504 год .",давид,PERSON,11,17,0
"президент земан хотеть правительство коалиция , досрочный выборы .",президент,PROFESSION,0,9,0
"письмо , написать фридрих трумп 1905 год впервые опубликовать неделя немецкий журнал ' ' bild ' ' , адресовать принц - регент баварский луитпольд просьба позволить трамп остаться германия .",принц - регент баварский,PROFESSION,128,153,0
"предположительно штраф определить размер 4 , 3 тыс . доллар каждый баррель нефть , вытечь мексиканский залив .",мексиканский,COUNTRY,103,115,0
эннио моррикона написать музыка 400 американский европейский кинокартина телесериал .,американский,COUNTRY,49,61,0
чавес назначить преемник направиться куба лечить рак,чавес,PERSON,0,5,0
"подвижка политический система чехия дисбаланс власть , инициировать земан , мочь означать движение направление - модель , напоминать , существовать довоенный чехословакия .",чехословакия,COUNTRY,184,196,0
мид россия потребовать реакция сша сообщение хакерский атака .,мид,ORGANIZATION,0,3,0
"данный момент петиция change . org набрать 500 000 голос [ https : / / www . change . org / p / % d 0 % be % d 1 % 82 % d 0 % bc % d 0 % b 5 % d 0 % bd % d 0 % b 0 - % d 0 % bf % d 0 % b 0 % d 0 % ba % d 0 % b 5 % d 1 % 82 % d 0 % b 0 - % d 1 % 8 f % d 1 % 80 % d 0 % be % d 0 % b 2 % d 0 % be % d 0 % b 9 отменить « пакет яров » ] , сайт рой — 51 000 [ https : / / www . roi . ru / 28432 / отменить « закон яров » ] .",яров,PERSON,221,227,0
"ряд пополнить народный артист россия , сценарист кинорежиссёр владимир бортко звезда молодёжный сериал мария кожевников .",россия,COUNTRY,34,40,0
"глинка погибнуть 25 декабрь 2016 год крушение самолёт - 154 минобороны рф , ход гуманитарный поездка сирия .",сирия,COUNTRY,110,115,0
"конец война « голос америка » вещать 40 язык , программа состоять музыка , новость аналитический комментарий .",голос америка,ORGANIZATION,15,28,0
результат налёт погибнуть представитель афганский сила безопасность боевик талибан » .,представитель афганский сила безопасность,PROFESSION,29,69,0
"« весь наш долгий карьера довестись играть многий интересный место , это шоу гавана стать важный событие , надеяться , наш кубинский друг » , — это отметить заявление группа , опубликовать прибытие музыкант куба .",куба,COUNTRY,272,276,0
соавтор rss сооснователь reddit аарон шварц покончить,аарон шварц,PERSON,34,45,0
"гражданский демократ надеяться , непартийный правительство голосование чешский парламент получить необходимый поддержка 101 голос депутат , президент вынудить обратиться создание правительство вновь ods .",президент,PROFESSION,173,182,0
"лауреат категория « артист год » , « хороший автор песня » « прорыв год » определять команда редактор apple music , который входить музыкальный критика знаменитость .",артист,PROFESSION,24,30,0
китай забанить блогер фейк кликбейт,китай,COUNTRY,2,7,0
это год нобелевский премия мир претендовать 200 человек 85 организация .,нобелевский,PERSON,15,26,0
"президент заявить , , « многочисленный просьба » , пересмотреть обвинение убийство , выдвинуть голстейн , который прошлый служить спецвойско ( « зелёный берет » ) .",зелёный берет,ORGANIZATION,150,164,0
правительство палестина глава премьер - министр ахмед курей | ахмед курей подать отставка .,правительство,ORGANIZATION,0,13,0
адвокат алёхин оксана даров заявить политический ангажированность весь процесс : « маша являться человек крайне активно участвовать гражданский жизнь страна — всюду 5 - летний филипп .,алёхин,PERSON,8,16,0
"встреча принимать участие председатель партия , миллиардер бидзин иванишвили глава правительство квирикашвили .",бидзин иванишвили,PERSON,61,79,0
"аккаунт лидер основатель рок - группа « жар - птица » ( г . дубна ) сергей попов дом культура ( мм дк ) появиться сообщение отмена , наметить 29 март 2020 год презентация бокс - сет команда « антология » , выпустить издательство « перец рекордз » .",жар - птица,ORGANIZATION,43,52,0
"крестный ход , который принимать участие житель несколько область республика россия , посвятить 430 - й годовщина явление чудотворный казанский икона божий мать .",россия,COUNTRY,81,87,0
"78 - летний веннер , бывший член « секретный вооружённый организация » ( oas ) — террористический движение националистический толк , вторник застрелиться глаз множество турист внутри посещать здание франция .",oas,ORGANIZATION,67,70,0
"россиянин оценить нестандартный сюжет картина , который повествовать чернокожий музыкант дон ширлить шофер — италоамериканец тони валлелонг , который приходиться поехать гастроль южный штат америка , 1960 - х год сей пора сильный расовый предрассудок .",музыкант,PROFESSION,78,87,0
"гейтс сравнить переход традиционный туалет модель , использовать вода , развитие техника середина 1970 - х год , создать microsoft .",гейтс,PERSON,0,5,0
мид россия потребовать реакция сша сообщение хакерский атака,хакерский,PROFESSION,49,58,0
чехов единственный забитый мяч счёт вацлав пиларжа .,чехов,NATIONALITY,2,7,0
' стив ирвин ' ( steve irwin ) — известный австралийский натуралист телевизионный ведущий погибнуть укол жалить скат время подводный съёмка .,натуралист,PROFESSION,53,63,0
"предварительный результат парламентский выборы , состояться азербайджан , победа подавлять преимущество одержать партия « новый азербайджан » президент страна ильхам алиев .",новый азербайджан,ORGANIZATION,135,152,0
аятолл хаменея назвать удар сирия преступление,аятолл,PROFESSION,0,7,0
"бывший президент бразилия луис силва пройти курс химиотерапия прошлый год , врач сообщить , лечение уменьшить опухоль 75 процент .",врач,PROFESSION,81,86,0
"также предположить , сша намерить добиться начало страна гуманитарный кризис уморить венесуэльский народ голод .",венесуэльский,NATIONALITY,96,109,0
"выдвижение кандидатура керри , представлять сенат штат массачусетс номинироваться пост президент 2004 год , ожидаться ещё прошлый неделя , представитель сша оон сьюзан райса попросить президент обама снять кандидатура .",сша,COUNTRY,177,180,0
халк 21 - й минута решиться выстрел - предел штрафной .,халк,PERSON,0,4,0
"политик добавить , намеренный вернуться работа поддержка независимый кандидат выборы мосгордума .",политик,PROFESSION,0,7,0
"надаля это шестой поражение сербский теннисист это год , причём каждый проигрывать финальный матч различный чемпионат , число — уимблдон .",теннисист,PROFESSION,54,64,0
"слово рэппа , это произойти вечеринка дом спейся , всё гость разойтись .",спейся,PERSON,54,60,0
"сообщать официальный блог создатель компьютерный антивирус mcafee джон макафи ( john mcafee ) , 1 декабрь 2012 год полиция белиз арестовать миллионер попытка пересечение граница белиз мексика : ' ' « получить неподтверждённый сведение , джон макафи схватить граница белиз мексика » ' ' .",john mcafee,PERSON,86,97,0
первообраз храниться церковь святитель николай чудотворец село балыкино погарский район брянский область .,николай чудотворец,PERSON,39,57,0
"хореограф уверенный , спектакль сегодняшний день , день минувший — современный эмоция , прямой параллель действительность оставлять равнодушный зритель наш время .",хореограф,PROFESSION,0,9,0
киев стартовать творческий проект « антропоморфий украинский степь »,украинский,COUNTRY,51,61,0
"бывший фронтмен группа dion and the belmonts , певец композитор дион димуччи подать суд компания zenimax media .",композитор,PROFESSION,54,64,0
"президент сша барак обама пятница официально выдвинуть кандидатура сенатор - демократ джон керри пост государственный секретарь , начать самый работа формирование новый аппарат национальный безопасность .",государственный секретарь,PROFESSION,107,133,0
исполнитель роль тьюринг бенедикт камбербэтч кинофестиваль торонто 2014 год,бенедикт камбербэтч,PERSON,26,45,0
"22 - летний старшов прийти группировка вместе певица флорида чантурия апрель 2016 год , сразу уход алиса вокс .",старшов,PERSON,10,18,0
журналист андреа рокелли российский коллега андрей миронов погибнуть результат миномётный обстрел вблизи славянск восток украина .,журналист,PROFESSION,0,9,0
"греческий демонстрант собраться центральный площадь синтагматос , пойти посольство сша .",посольство сша,ORGANIZATION,91,105,0
"« погибнуть мученический смерть , защищать республика » , — заявить лидер всеобщий народный конгресс файк аль - саид , обвинить убийство салех мятежник - хути ( хусит — шиитский повстанец ) .",лидер всеобщий народный конгресс,PROFESSION,62,97,0
"64 - летний лидер гражданский инициатива « свобода , демократия , правда » , иванович считаться умеренный политик .",политик,PROFESSION,98,107,0
настоящий время её жизнь бороться врач 17 - й больница украинский столица .,украинский,COUNTRY,58,68,0
"словакия , мнение земан , должный отправиться супруг экс - президент чехия ливия клаусов .",президент чехия,PROFESSION,61,77,0
"судебный процесс , начаться минувший среда гаага международный трибунал дело бывший югославия ( мтбь ) , бывший командующий армия боснийский серб генерал ратко младич предъявить 11 обвинение .",мтбь,ORGANIZATION,111,115,0
день старший дочь президент – малия – исполняться 14 год .,президент,PROFESSION,27,37,0
"кейт выдвинуть партия "" объединение мали "" ( rassemblement pour le mali , rpm ) , руководитель который являться .",мали,COUNTRY,39,43,0
"сша назвать шаг « значительный эскалация » конфликт сирийский правительство повстанец , противостоящий президент башар асад .",сирийский правительство,ORGANIZATION,63,87,0
президент республика македония георге иванов 13 июнь 2018 год отказаться подписать соглашение переименование страна республика северный македония .,президент республика македония,PROFESSION,0,30,0
"потребоваться четыре сет четыре час , одержать победа соперник , который победить прошлогодний финал ' ' us open ' ' .",us,COUNTRY,142,144,0
"1931 год самбук работать институт оленеводство васхнил , совмещать работа работа ботанический институт .",самбук,PERSON,12,18,0
"владислав сурков , дмитрий рогозин аркадий дворкович",дмитрий рогозин,PERSON,18,33,0
"« спартак » смочь помочь инсаурральд парех , получить красный карточка , также эменик , получить четвёртый жёлтый карточка сезон .",спартак,ORGANIZATION,4,12,0
пластинка автограф леннон убийца продать акцион сша,леннон,PERSON,23,30,0
"палестинец убить , сотня человек получить ранение результат столкновение .",палестинец,NATIONALITY,4,14,0
"однако президент , который возвращаться домой германия 8 июль , изменить план « лично продиктовать заявление имя трамп - младший , который говориться , сын российский адвокат „ главный образ обсуждать программа усыновление российский ребёнок “ » , писать ' ' washington post ' ' , ссылаться анонимный источник , знакомый ситуация .",трамп - младший,PERSON,117,132,0
пятница — 28 июнь 2013 год российский прокуратура обратиться московский суд просьба ограничить свобода передвижение медиамагнат александр лебедев 21 месяц избиение свой оппонент — сергей полонский телешоу .,прокуратура,ORGANIZATION,41,52,0
"полицейский франция застрелить шериф шекатта ( ch rif chekatt ) , 29 - летний уроженец страсбург , подозревать вооружённый нападение прохожий центр город .",франция,COUNTRY,15,22,0
столичный клуб эйсебио 11 становиться чемпион португалия 3 — вица - чемпион страна .,португалия,COUNTRY,54,64,0
"руководство ods top 09 подобный условие необходимо просчитать политический ход , получить хороший счёт свой польза предстоящий выборы .",ods,ORGANIZATION,12,15,0
"это успеть поработать известный it - компания , sun novell , однако больший заслуга добиться именно пост руководитель google .",руководитель google,PROFESSION,128,147,0
"американский военный провинция бадгис , афганистан , 2011 год",американский военный,PROFESSION,0,20,0
несколько час убийство чэпмена подойти леннон вход дом попросить подписать экземпляр ' ' double fantasy ' ' .,чэпмена,PERSON,31,37,0
это кандидат республиканский партия дональд трамп стать комментировать последний инцидент здоровье хиллари клинтон .,хиллари клинтон,PERSON,113,128,0
"группа состоять участник : мэттью белла ( вокал , гитара , клавиша ) , крис уолстенхолма ( бас - гитара , бэк - вокал , вокал ) доминик ховард ( ударный ) .",доминик ховард,PERSON,128,144,0
"разговор тайный агент фбр , который притворяться представитель иго , джеймсон просить автомат компонент изготовление бомба .",тайный агент фбр,PROFESSION,14,34,0
персональный выставка народный художник ссср александр шилов неоднократно проходить белоруссия .,художник,PROFESSION,32,41,0
"свой сторона мочь сказать , россельхознадзор — , частность , глава россельхознадзор — действовать согласно существующий законодательный база , российский , международный .",глава россельхознадзор,PROFESSION,71,94,0
"август 1995 год солоник появиться афины , последующий год скрываться граница , начало 1997 год вместе известный фотомодель , манекенщица московский агентство red stars финалистка конкурс красота « мисс россия - 96 » 22 - летний светлана котов осесть греция имя владимир кесова .",солоник,PERSON,24,31,0
"амато предложить , католик весь мир начать организовать протест против фильм « код винчи » точно , протест против фильм мартин скорсез ( martin scorsese ) « последний искушение христос » 1988 год .",martin scorsese,PERSON,169,184,0
сообщение пресс - служба цб рф говориться :,пресс - служба цб рф,ORGANIZATION,12,30,0
"вопреки предсказание большинство спортивный аналитик , сборная россия , считаться главный кандидат выход следующий раунд турнир группа « » , смочь обыграть грек , команда который копилка это матч весь очко .",спортивный аналитик,PROFESSION,34,55,0
"генпрокуратор украина считать , организовать акция протест финансироваться россия окружение экс - президент виктор янукович , частность , сергей курченко , направить свержение государственный власть .",украина,COUNTRY,15,22,0
"хакер конфисковать ноутбук asus , usb модем dvd диск вредоносный .",хакер,PROFESSION,2,8,0
"великобритания прекратить экспорт тиопентал натрий ноябрь , правозащитный организация « reprieve » ( дословно « отсрочка » ) предъявить правительство иск требование прекратить экспорт указанный вещество сша .",отсрочка,ORGANIZATION,125,133,0
7 июнь 2013 год следственный комитет россия челябинский область сообщить завершение расследование уголовный дело отношение мужчина определённый место жительство обвинять совершение насильственный действие сексуальный характер отношение 11 - летний мальчик пожилое мужчина .,следственный комитет россия,ORGANIZATION,17,44,0
"аветисян также поблагодарить содействие принятие резолюция автор — конгрессмен хетч , также джеймс галстян шериф мидлесекс питер кутунджян усилие защита сша интерес арцах .",сша,COUNTRY,183,186,0
министр иностранный дело венесуэла хорх арреас назвать санкция « плохой акт агрессия против венесуэла последний 200 год » .,министр иностранный дело венесуэла,PROFESSION,0,33,0
