text,entity,entity_tag,entity_pos_start_rel,entity_pos_end_rel,category
"фильм снятой книга эндрю ходжес « алан тьюринг : энигма » описывать жизнь работа знаменитый английский математик алан тьюринг , который помочь взломать код немецкий шифровальный машина энигма время второй мировой война .",немецкий,COUNTRY,162,170,0
"вечером четверг , 19 декабрь 2019 год , здание фсб москва произойти нападение применение огнестрельный оружие .",фсб,ORGANIZATION,50,53,0
израиль отмечать йом ха - зикарон - день память пасть война израиль жертва террор .,израиль,COUNTRY,2,9,0
"китайский власть расследовать деятельность северокорейский банк , подозревать финансирование импорт товар , который пхеньян , возможно , использовать свой ядерный программа .",китайский,COUNTRY,0,9,0
"мать рядовой владислав челах , обвинять убийство 14 пограничник егерь , свидание сын заметить след побои .",пограничник,PROFESSION,59,72,0
"доминик стросс - кан - член социалистический партия франция рассматриваться , главный соперник французский президент николя саркози предстоящий 2012 год выборы .",французский президент,PROFESSION,98,121,0
"главный роль сыграть бенедикт камбербэтч , кира найтлить , мэттью гуд , марк стронг , рорь киннир др .",бенедикт камбербэтч,PERSON,24,43,0
"11 январь 2013 год свой квартира нью - йорк повеситься 26 - летний аарон шварц ( aaron swartz ) — американский программист , интернет - активист , писатель борец свобода интернет .",писатель,PROFESSION,143,151,0
"приз хороший иностранный документальный фильм жюри присудить камбоджийский лента « река менять течение » деревенский житель , переезжать пномпень .",камбоджийский,COUNTRY,63,76,0
"фильм снятой книга эндрю ходжес « алан тьюринг : энигма » описывать жизнь работа знаменитый английский математик алан тьюринг , который помочь взломать код немецкий шифровальный машина энигма время второй мировой война .",эндрю ходжес,PERSON,20,33,0
ученик четвёртый класс лицей № 21 иваново ярослав минник удостоить высокий награда xiv всероссийский детский конференция « первый шаг наука » труд « влияние киберкультура школьник » ( научный руководитель — учитель биология 21 - го лицей ) .,учитель биология 21 - го лицей,PROFESSION,215,243,0
"роль премьерный показ исполнить : сергей астахов ( роберт ) , w : елена корикова ( фред ) , светлана иванов ( бетти ) , андрей чернышов ( стэнтон ) , ольга красько ( олуэн ) , иван жидков ( гордон ) .",ольга красько,PERSON,141,154,0
власть северный корея осудить глава мид япония фумио кисида высказывание наращивание давление пхеньян .,глава мид япония,PROFESSION,30,46,0
"родитель дуглас гершлый брайна даниелович переехать америка 1910 год белорусский городок чаус ( могилёвский губерния , российский империя ) поселиться город амстердам ( нью - йорк ) .",гершлый,PERSON,17,22,0
"132 ук рф ( насильственный действие сексуальный характер , совершенный отношение лицо , достигнуть 14 - летний возраст ) ч .",рф,COUNTRY,7,9,0
"« социальный издержка » центр « относительно небольшой » , сравнить чечня , афганистан сирия , утверждать газета .",сирия,COUNTRY,100,106,0
"частность вперёд выйти железный человек 3 , обливион , семейка крудс китайский драма so young .",крудс,PERSON,63,68,0
"город павий , тюрьма который содержаться украинский боец откуда род убитый итальянский журналист",итальянский,COUNTRY,80,91,0
"противник однополый брак , французский писатель историк доминик веннер застрелиться собор парижский богоматерь",доминик веннер,PERSON,59,73,0
"кроме , экс - президент грузия обвинить растрата госсредство , незаконный присвоение имущество бизнесмен бадри патаркацишвили , организация нападение депутат валерий гелашвили 2005 год препятствование расследование убийство банкир сандро гиргвлиани .",валерий гелашвили,PERSON,167,184,0
"спасатель сообщать , ранение получить , малый мера , 7 человек , включая двое пилот .",пилот,PROFESSION,86,93,0
собираться пострадать писать заявление нападение полиция добиваться наказание злоумышленник — сообщаться .,полиция,ORGANIZATION,58,65,0
"мэри шапиро , возглавить комиссия сша ценный бумага биржа ( sec ) финансовый кризис , покинуть свой пост , передавать new york times ссылка неназванный представитель администрация президент сша барак обама .",комиссия сша ценный бумага биржа,ORGANIZATION,26,65,0
"американский финансово - экономический журнал forbes назвать 15 книга , представлять совершенный анализ управление капитал , самый помогать жаждать богатство достигнуть свой цель , сообщать newsru . com .",американский,COUNTRY,0,12,0
вчера « пересвет » суметь привлечь миллиард рубль путём размещение облигация .,пересвет,ORGANIZATION,7,15,0
анджелина джоля удалить оба грудь notoc,анджелина джоля,PERSON,0,15,0
"слово эрлить , размер штраф соответствовать наказание , принять турнир большой шлем .",эрлить,PERSON,10,14,0
"заявить риа новость представитель совет национальный безопасность белый дом марк строха , президент ясно дать понять , сша защитить свой интерес , число киберпространство .",представитель совет национальный безопасность белый дом,PROFESSION,23,81,0
"предположительно , группировка шакирьянов входить структура "" имарат кавказ "" , возглавлять лидер северокавказский боевик док умаров .",док умаров,PERSON,138,151,0
"браво » , — заявить актёр , продюсер директор нейл патрик харрис , известный свой роль сериал « доктор дуга хаузер » ( doogie howser , m . d . ) « встретить ваш мама » ( how i met your mother ) .",doogie howser,PERSON,121,134,0
", принадлежать около 3 процент акция google , , нынешний цена , равняться семь миллиард доллар .",google,ORGANIZATION,45,51,0
это 14 декабрь 2018 год французский сми рассказать источник правоохранительный орган страсбург .,правоохранительный орган страсбург,ORGANIZATION,72,109,0
"пиццерия zizzi британский солсбери , обедать 4 март 2018 год отравить экс - сотрудник гру сергей скрипаль дочь юлия , обнаружить след нервно - паралитический отравлять вещество .",сотрудник гру,PROFESSION,86,99,0
2011 год сербский власть арестовать доставить гаага .,сербский власть,ORGANIZATION,12,27,0
"британский портал bbc news сообщать ужасный трагедия , произойти накануне .",британский,COUNTRY,0,10,0
"однако заговор провалиться , мартин , нога который татуировка образ бибер , передумать сообщить власть .",мартин,PERSON,33,39,0
"участник форум получить возможность узнать последний тенденция мир мобильный приложение , выиграть планшет , электронный книга « lexand » , компьютерный мышь « logitech » ценный приз партнёр форум .",lexand,ORGANIZATION,147,153,0
"работать препаратор гербарий академия наука ссср , ботаник отдел геоботаник ботанический институт ан ссср .",препаратор,PROFESSION,8,20,0
обвинять короткий слушание федеральный суд олбаня выступать .,федеральный суд,ORGANIZATION,40,56,0
"главный роль сыграть бенедикт камбербэтч , кира найтлить , мэттью гуд , марк стронг , рорь киннир др .",мэттью гуд,PERSON,58,68,0
конфликт правительство премьер шпидло руснок заявить свой уход политика ( это оказаться солидарный земан ) последний время работать частный сектор качество председатель ассоциация пенсионный фонд .,премьер,PROFESSION,34,43,0
"время штурм произойти перестрелка , который погибнуть четверо агент шесть член религиозный секта .",агент,PROFESSION,65,72,0
"друг твит хаменея заявить , сша сыграть главный роль создание исламский государство ( иго ) саудовский деньга , направить затем иго « против иракский сирийский народ » .",иго,ORGANIZATION,95,97,0
"слово министр внутренний дело афганистан , двое нападать убить сотрудник сила безопасность .",сила безопасность,ORGANIZATION,87,103,0
"праздничный торжество начаться гора герцелить иерусалим , собраться многие видный израильский общественный политический деятель , президент израиль шимон перес премьер - министр израиль биньямин нетаньяху , также участие траурный церемония принять министр депутат кнессет .",министр,PROFESSION,267,275,0
"январь 2010 год , менее месяц окончание срок свой полномочие , президент украина виктор ющенко посмертно присвоить бандёр звание герой украина .",президент украина,PROFESSION,76,93,0
"получить образование сша , проживать течение несколько десятилетие .",сша,COUNTRY,22,25,0
"доклад основать предположение , доказательство , сказать председатель румынский парламентский комиссия ромео раёк ( romeo raicu ) бухарест .",romeo raicu,PERSON,125,136,0
"знаковый рок - культура событие , который непосредственно связать имя сергей , стать рок - фестиваль « подольск - 87 » , современный группа « алиби » стать сенсация , также процесс , который привести тюремный заключение участник группа « воскресение » алексей романов звукоинженер александр арутюнов .",воскресение,ORGANIZATION,246,257,0
сообщение представитель правоохранительный орган проверка соблюдение миграционный законодательство проводиться территория область дальнейший .,правоохранительный орган,ORGANIZATION,29,55,0
"2016 год возраст 23 год стать посол добрый воля управление оон наркотик преступность , торговля человек условие конфликт .","посол добрый воля управление оон наркотик преступность , торговля человек условие конфликт",PROFESSION,40,143,0
"завершение сериал июнь 2007 год сняться несколько кинофильм , число триллер « цель номер » ( zero dark thirty ) комедия « невероятный береть уандерстоун » ( the incredible burt wonderstone ) .",burt wonderstone,PERSON,193,209,0
"сообщение афганский власть , террорист - самоубийца , управлять заминировать автомобиль , атаковать колонна иностранный войско кабул .",афганский власть,ORGANIZATION,13,30,0
здание мвд верховный суд венесуэла обстрелять вертолёт,верховный суд,ORGANIZATION,13,28,0
"решение принять столичный градоначальник несмотря обращение родный погибший 2005 год бразилец жан - шарль де менезиш , призывать отказать согласование кандидатура .",бразилец,NATIONALITY,99,108,0
"аккаунт лидер основатель рок - группа « жар - птица » ( г . дубна ) сергей попов дом культура ( мм дк ) появиться сообщение отмена , наметить 29 март 2020 год презентация бокс - сет команда « антология » , выпустить издательство « перец рекордз » .",дом культура,ORGANIZATION,81,94,0
"венесуэла | венесуэла 7 октябрь 2012 год проходить президентский выборы венесуэла ( 2012 ) | президентский выборы , который , мнение аналитик , стать самый напрячь весь политический карьера действовать лидер страна чавес , уго | уго чавес , пробыть власть 14 год .",венесуэла,COUNTRY,74,83,0
"отец владислав сурков — дудаев андарбек данильбекович ( кличка юрий ) , некоторый данные , мать — сурков зоя антонович работать учитель дуб - юртский школа .",учитель,PROFESSION,135,143,0
"течение день выступить группа : цемент ( рига ) , телевизор ( ленинград ) , алиби ( дубна ) , хроноп ( нижний новгород ) , леонора гнедлера ( экс - цемент ) ( рига ) , j . m . k . e . ( таллинн ) .",цемент,ORGANIZATION,138,144,0
проект участвовать рэп исполнитель видеооператор карина куча звукорежиссёр ксения абрамов роль алиенисткать ярослав клапрус роль молодой девушка жертва,ксения абрамов,PERSON,78,93,0
"релиз войти 19 композиция , запись принять участие также певица бейонс , алиш киз британский музыкант эда ширан .",музыкант,PROFESSION,103,111,0
"однако пресс - секретарь президент альфредо скоссимарро заявить суббота , исследование удалённый железа выявить наличие раковый клетка : « врач сообщить , последний гистологический исследование выявить раковый клетка , образ , уточнить предыдущий диагноз » .",пресс - секретарь президент,PROFESSION,7,33,0
"встреча принимать участие председатель партия , миллиардер бидзин иванишвили глава правительство квирикашвили .",глава правительство,PROFESSION,82,101,0
житель регион готовиться назначить воскресение референдум отсоединение украина возможный вступление состав рф .,украина,COUNTRY,86,93,0
"однако целое зритель считать эпизод интересный , писать издание abacus .",abacus,ORGANIZATION,64,70,0
"доклад основать предположение , доказательство , сказать председатель румынский парламентский комиссия ромео раёк ( romeo raicu ) бухарест .",romeo raicu,PERSON,125,136,0
"виновник происходить певец считать « , стать вредность прикол голосовать » выборы .",певец,PROFESSION,25,30,0
"ученик школа № 6 верхнесалдинский городской округ владимир хитрина май 2018 год , заметить драка ранее незнакомый мужчина , позвать помощь прохожий , вызвать полиция дождаться приезд .",владимир хитрина,PERSON,53,68,0
"презентация выступить директор журнал ' ' magic woman ' ' анастасия горецкий , главный редактор анна сатановский , редактор эксперт геомантия оксана боуш .",эксперт геомантия,PROFESSION,124,144,0
"ведущий католическо - традиционалистский радиостанция неоднозначно воспринимать историк публицист , веннер ранее день опубликовать свой сайт эссе , который призвать « новый , эффектный символический акция , который должный пробудить сон , встряхнуть одурманить ум расшевелить память наш происхождение » .",веннер,PERSON,106,112,0
"скульптура давид , изображать соперник голиаф библейский сюжет , создать итальянский художник микеланджело буонарротить 1501 — 1504 год .",микеланджело буонарротить,PERSON,105,128,0
12 июнь афины скопье достигнуть прогресс переговоры спорный вопрос название македония .,македония,COUNTRY,87,96,0
автобус kia granbird принадлежать местный турфирма ( перевозчик — индивидуальный предприниматель сергей пнёв ) совершать заказной нерегулярный рейс маршрут сретенск — чита протяжённость 360 километр .,индивидуальный предприниматель,PROFESSION,64,94,0
"информация tmz , баскетболист передвигаться собственный частный вертолёт , произойти пожар .",баскетболист,PROFESSION,19,31,0
это 19 - летний джон эрнест студент филиал университет штат калифорния город сан - маркос .,филиал университет штат калифорния город сан - маркос,ORGANIZATION,37,94,0
2012 год мурси победить второй тур президентский выборы .,президентский,PROFESSION,41,54,0
"категория « электронный книга » победить детский мультимедийный проект « жуж » , номинация « отпечатать россия » награда получить « история денежный обращение россия : альбом - каталог , монография 2 - х » ( интеркрим - пресс , отпечатать "" полиграфкомплекс « локус станди » ) .",россия,COUNTRY,106,112,0
"« пасть мочь оказаться сегодня , увидеть чудо , - отметить премьер .",премьер,PROFESSION,87,94,0
"согласно конституция малави , вица - президент управлять страна истечение президентский срок скончаться глава государство , который истекать начало 2014 год .",глава государство,PROFESSION,116,133,0
"коби бин брайант , американский профессиональный баскетболист , играть позиция атаковать защитник выступать « лос - анджелес лейкерс » течение 20 сезон национальный баскетбольный ассоциация .",атаковать защитник,PROFESSION,79,99,0
"атаулла афган , глава совет провинция гильменд , рассказать , среди погибнуть результат налёт оказаться , число , командир батальон дорожный полиция .",командир батальон дорожный полиция,PROFESSION,121,156,0
"ход голосование правительство остров решение подать 27 голос , шесть воздержаться , сообщить агентство reuters член парламент .",член парламент,PROFESSION,120,135,0
линейный ускоритель электрон австралийский синхротрон,австралийский синхротрон,ORGANIZATION,35,61,0
"мраморный статуя давид работа микеланджело , находиться академия изящный искусство флоренция ( италия ) , спрогнозировать разрушение - излишний вибрация .",давид,PERSON,17,23,0
