text,entity,entity_tag,entity_pos_start_rel,entity_pos_end_rel,category
северный корея пригрозить нанести превентивный ядерный удар сша япония,северный корея,COUNTRY,0,14,-1
ущерб « сотрудничество » visa период 2004 2012 год walmart оценивать 5 млрд доллар сша .,walmart,ORGANIZATION,62,69,-1
"сообщаться , объявление свержение мурси сотрудник служба безопасность египет ворваться телестудия « аль - джазира » арестовать несколько сотрудник .",аль - джазира,ORGANIZATION,113,124,-1
"замоскворецкий суд москва признать уроженец дагестан , чемпион мир самбо смешанный единоборство расул мирзаева виновный причинение смерть неосторожность 19 - летний москвич иван агафонов , приговорить преступник год ограничение свобода , освободить зал суд .",расул мирзаева,PERSON,103,118,-1
"данные расследование , который вести совет европа , германия принимать участие секретный операция цру перевозка заключить , подозревать терроризм .",цру,ORGANIZATION,102,105,-1
земан пугать обещание коалиция сорвать принятие бюджет следующий год .,земан,PERSON,0,6,-1
власть северный корея осудить глава мид япония фумио кисида высказывание наращивание давление пхеньян .,власть северный корея,ORGANIZATION,0,21,-1
"высокий руководитель иран , великий аятолл али хаменея назвать преступление ракетный удар сирия , который нанести сша союзник , лидер западный страна — преступник .",лидер западный страна,PROFESSION,138,165,-1
"сказать , , невиновный , отсидеть срок тюрьма ложный обвинение пытать « гражданский платформа » , член который являться погибший мэр .",гражданский платформа,ORGANIZATION,92,113,-1
саакашвили покинуть грузия вступление должность новый президент страна георгий маргвелашвили ноябрь 2013 год .,саакашвили,PERSON,0,10,-1
"ответ спикер госдума сергей нарышкин пообещать поставить вопрос поведение пономарёв заседание думский комиссия этика , глава лдпр владимир жириновский потребовать лишить пономарёв мандат , депутат - единоросс александр хинштейн назвать « врун » , заявить , « слово ранита сильный , дело » .",пономарёв,PERSON,178,188,-1
некоторый писать краска тротуар : « американец — убийца человек » .,американец,NATIONALITY,39,49,-1
"повторить обвинение , сша пытаться расширить присутствие иго афганистан .",иго,ORGANIZATION,62,64,-1
"вопрос травма основный вратарь сборная игорь акинфеев , получить матч российский премьер - лига « спартак » цска , адвокат ответить , « футболист приходить пресс - конференция , говорить сборная россия , „ зенит “ , „ спартак “ цска » .",цска,ORGANIZATION,128,132,-1
"август 2017 год квачковы вновь оказаться скамья подсудимый : находиться тюрьма , записать передать воля видеообращение , который следствие усмотреть признак возбуждение ненависть либо вражда ( « политический » статья 282 ук рф ) .",квачковы,PERSON,23,30,-1
"ранее это сделать депутат « справедливый россия » илья пономарёв , свой выступление охарактеризовать « единый россия » « партия жулик вор » ( выражение алексей навальный ) выразить убеждение , новый законодательный акт послужить повод репрессивный мера .",единый россия,ORGANIZATION,106,119,-1
полиция белиз объявить розыск 67 - летний макафи связь убийство грегори фолл ещё 12 ноябрь 2012 год .,макафи,PERSON,45,51,-1
"неназванный представитель армейский коммандование сообщать , мурси « нажить враг среди египтянин » .",египтянин,NATIONALITY,96,103,-1
однако городской управлять кембридж роберт хиль призвать родный царнаева обращаться просьба :,царнаева,PERSON,66,74,-1
"8 апрель 2013 год эксгумировать тело , умерший 40 год назад , известный чилийский поэт пабло неруда , связь информация , поступить бывший шофер , который утверждать , нобелевский лауреат отравить приказ диктатор аугусто пиночет .",аугусто пиночет,PERSON,251,267,-1
"матч « спартак » стать первый увольнение тренер унай эмери , который покинуть команда разгромный поражение « динамо » счёт 1 : 5 .",унай эмери,PERSON,62,72,-1
"юноша клясться преданность « халиф » аль - багдади , утверждать , « победа неверный война близкий » , иметь вид страна коалиция ирак сирия .",сирия,COUNTRY,144,149,-1
"очень ценить профессиональный качество илья бер , однако считать правильный отстранить работа программа неопределённый срок .",илья бер,PERSON,41,50,-1
"власть сирия отвергать обвинение заявлять , сообщение химический атака выдумать повстанец , это мнение разделять россия .",россия,COUNTRY,125,131,-1
"свой обращение нация вторник вечером глава военный совет сообщить , принять отставка правительство исам шараф , который потерять доверие большинство египтянин , поручить министр выполнять свой полномочие формирование новый кабинет .",правительство исам шараф,ORGANIZATION,96,122,-1
"матч « спартак » стать первый увольнение тренер унай эмери , который покинуть команда разгромный поражение « динамо » счёт 1 : 5 .",спартак,ORGANIZATION,15,23,-1
"зритель организатор соревнование очевидный , посеять первый номер пара китаянка ван сяоля юй ян , пара южнокорейский спортсменка ( чун кюн ын / ким ха ха чжон ын / ким мина чжон ) индонезийский дуэт ( греться полия мейлиана джаухарь ) намеренно пытаться проиграть свой матч , кубковый часть соревнование выйти нужный противник повысить свой шанс медаль .",ха чжон ын,PERSON,178,188,-1
многие критика негативно отнестись появление поп - звезда пластинка .,поп - звезда,PROFESSION,47,56,-1
"« спартак » смочь помочь инсаурральд парех , получить красный карточка , также эменик , получить четвёртый жёлтый карточка сезон .",инсаурральд,PERSON,31,43,-1
южный северный корея обменяться артиллерийский выстрел .,северный корея,COUNTRY,8,22,-1
"зритель организатор соревнование очевидный , посеять первый номер пара китаянка ван сяоля юй ян , пара южнокорейский спортсменка ( чун кюн ын / ким ха ха чжон ын / ким мина чжон ) индонезийский дуэт ( греться полия мейлиана джаухарь ) намеренно пытаться проиграть свой матч , кубковый часть соревнование выйти нужный противник повысить свой шанс медаль .",ким ха,PERSON,166,175,-1
"мадурый , пользоваться поддержка китай россия , закрыть граница американский помощь , принять помощь красный крест .",американский,COUNTRY,67,79,-1
"республика сей пора ежедневно происходить нападение полицейский чиновник , некоторый аналитик считать , насилие стать прямой результат подавление кремль инакомыслие .",кремль,ORGANIZATION,169,176,-1
"поздний магнитский арестовать обвинение коррупция самый чиновник , который причастный раскрытый преступный схема .",магнитский,PERSON,12,22,-1
26 октябрь 2012 год суд милан признать бывший премьера италия сильвио берлускони виновный схема уклонение уплата налог приговорить четыре год тюрьма .,суд милан,ORGANIZATION,21,31,-1
таможенный контроль сторона беларусь возобновиться введение россия запрет импорт продовольственный продукция белорусский предприятие россельхознадзор введение россия таможенный проверка транзит товар беларусь казахстан .,беларусь,COUNTRY,31,39,-1
это сообщать дик марти ( dick marty ) доклад расследование деятельность цру .,цру,ORGANIZATION,79,82,-1
итальянский суд приговорить украинский солдат 24 год тюрьма,итальянский суд,ORGANIZATION,0,15,-1
"бывший премьер италия обвиняться , 1990 - год неоднократно применять уход уплата налог финансовый схема использование офшорный компания .",премьер италия,PROFESSION,7,21,-1
"акция поддержка журналист иван голунов , который правоохранительный орган россия подбросить наркотик пытаться сфабриковать уголовный дело , состояться 12 июнь 2019 год , несмотря признание власть преступление сторона полицейский снятие журналист весь обвинение .",правоохранительный орган россия,ORGANIZATION,54,86,-1
"представитель партия президент зимбабве четверг объявить победа выборы глава государство , противник правозащитник заявлять массовый нарушение голосование , сообщать агентство рейтер .",партия президент зимбабве,ORGANIZATION,14,40,-1
"край увольнение . шемелево связывать неудовлетворительный результат единоросс парламентский выборы , состояться 4 декабрь 2011 г . приморье "" ер "" набрать 32 , 99 % , владивосток , . шемелеть баллотироваться 4 - му одномандатный избирательный округа , вовсе проиграть кпрф .",ер,ORGANIZATION,157,159,-1
"следствие показать , картер бить аллен , число нога , течение 25 минута .",картер,PERSON,24,30,-1
"мнение , госдума прошлый год принять некоторый закон , который крыться « экономический интерес человек власть » .",госдума,ORGANIZATION,15,24,-1
антидопинговый агентство сша ( usada ) лишить знаменитый велогонщик лэнс армстронг весь титул запретить участвовать соревнование .,лэнс армстронг,PERSON,67,83,-1
"заброс штрафной вывести данни ударный позиция грань офсайд , пробить неточно мяч попасть штанга .",данни,PERSON,24,29,-1
"согласно сообщение , хендрикс находиться контакт элтон симпсон , который апрель 2015 год осуществить закончиться провал попытка нападение место проведение это конкурс гарленд , штат техас .",хендрикс,PERSON,20,28,-1
"слово лидер оппозиция фил гофф , правительство образ хотеть протолкнуть свой программа приватизация .",правительство,ORGANIZATION,39,52,-1
"свергнуть президент египет бывший лидер исламистский организация « брат мусульманин » мухаммед мурси скончаться зал суд каир понедельник , 17 июнь 2019 год , время слушание дело причастность шпионаж .",мухаммед мурси,PERSON,88,102,-1
"второй сет трёхкратный чемпионка ' ' us open ' ' разразиться оскорбительный тирада адрес судья , оштрафовать выкрик « , давать ! » подача , который , считать , должный принести победа гейм .",судья,PROFESSION,92,97,-1
"ранее 2019 год суд сан - франциско обязать компания выплатить $ 78 млн американец — 46 - летний деуэйн джонсон , который выдвигать против monsanto обвинение .",monsanto,ORGANIZATION,153,161,-1
"начало кампания 50 - летний мадурый — бывший водитель автобус экс - министр иностранный дело — 10 процент опережать популярность каприлеса — 40 - летний губернатор штат венесуэла , который потерпеть серьёзный поражение чавес президентский выборы прошлый год .",каприлеса,PERSON,145,154,-1
"сообщение марти , вероятно , румыния использоваться аэропорт перевозка тайный заключить .",румыния,COUNTRY,33,40,-1
прокуратура предлагать ограничить свобода передвижение александр лебедев,прокуратура,ORGANIZATION,0,11,-1
саудовский аравия прекратить наземный сообщение катар .,катар,COUNTRY,50,57,-1
"сторонник бандёр утверждать , объединение нацист борьба против советский армия объясняться надежда , гитлер даровать украина независимость .",гитлер,PERSON,123,129,-1
"одновременно полиция задержать ещё ученик , который подозревать , помогать стрелка .",полиция,ORGANIZATION,13,20,-1
"запомнить , ваш солдат убивать , наш джихад продолжаться сила , пока оставаться хотя ваш военный .",военный,PROFESSION,130,137,-1
"перу расследование попасть пять экс - президент : альберто фухиморить ( 1990 — 2000 год ) , алехандро толедо ( 2001 — 2006 год ) , алан гарсия ( 1985 — 1990 2006 — 2011 год ) , ольянт умаленький ( 2011 — 2016 год ) педро пабло кучинск ( 2016 — 2018 год ) .",ольянт умаленький,PERSON,167,180,-1
"новый правительство палестина мочь попасть изоляция , оно противостоять палестинский террорист .",правительство палестина,ORGANIZATION,6,29,-1
"банк россия ввести временной администрация входящий первый сотня актив « коммерческий банк содействие благотворительность духовный развитие отечество „ пересвет “ » , крупный акционер который являться русский православный церковь .",пересвет,ORGANIZATION,161,169,-1
« марш зелёный » : петь дальнобойщик вадим дубовский вновь высмеять украинский президент,президент,PROFESSION,79,89,-1
"хейль подразумевать организовать мадурый конституционный ассамблея , присвоить законодательный полномочие – обход парламент , который контролировать оппозиция .",мадурый,PERSON,35,41,-1
"называть vestas « мировой лидер » производство ветрогенератор , марк назвать цель захват « требование правительство национализировать » , поскольку « vestas желать сохранить наш завод работать » .",правительство,ORGANIZATION,104,117,-1
"1986 корасон акино возглавить народный восстание поддержать военный , который привести бегство страна президент - диктатор фердинанд маркос , находиться власть 1965 год .",фердинанд маркос,PERSON,131,149,-1
"дефицит товарный торговля сша март увеличиться фон резкий падение экспорт автомобиль запчасть , импорт продолжать снижаться связь нарушение товарный поток - коронавирус .",сша,COUNTRY,26,29,-1
"вместе , обращение выразить поддержка позиция руководство россия "" связь недружественный проявление отношение россия сторона грузинский руководство "" .",грузинский руководство,ORGANIZATION,144,167,-1
"власть грузия придерживаться точка зрение депортация грузинский гражданин россия ; парламент грузия 23 октябрь , возможно , принять решение создание комиссия , призвать рассмотреть вопрос нарушение россия право гражданин грузия .",россия,COUNTRY,93,99,-1
"посол сша анкара пригласить мид встреча заместитель министр иностранный дело турция умитом ялчин , стать известно , власть сша выдать ордер арест некоторый турецкий гражданин , число сотрудник охрана наш президент , связь инцидент , произойти резиденция турецкий посол вашингтон 16 май .",турецкий гражданин,NATIONALITY,191,207,-1
малый мера трое боевик вели обстрел база расположить вблизи здание .,боевик,PROFESSION,21,29,-1
"обещать , правительство президентский ставленник получить поддержка утверждение парламент .",правительство,ORGANIZATION,17,30,-1
"« очевидный , это работа вражеский спецслужба » , — добавить , весь видимость , иметь вид россия .",россия,COUNTRY,89,95,-1
анкара произойти назвать провокация запретить турция рабочий партия курдистан .,рабочий партия курдистан,ORGANIZATION,63,88,-1
"пользователь сайт zhihu счесть насмешка зритель сторона сценарист самоубийственный атака всадник — король ночь мочь воскрешать пасть , новый труп усилить .",сценарист,PROFESSION,65,76,-1
тюменский районный суд вынести приговор отношение 36 - летний местный житель андрей кандыба .,андрей кандыба,PERSON,77,91,-1
"сопредседатель группа « экозащита ! » владимир сливяк отметить , предыдущий дума приучить экологический сообщество , особо хороший деятельность ожидать стоить .",дума,ORGANIZATION,75,79,-1
"макгоуэн также утверждать , продюсер изнасиловать её номер гостиница .",продюсер,PROFESSION,31,39,-1
обвинение дело предъявить саакашвили ноябрь 2014 год .,саакашвили,PERSON,41,51,-1
понедельник сирийский боевой самолёт выпустить ракета северный район ливан .,сирийский,COUNTRY,14,23,-1
афганский солдат убить американский военный,американский военный,PROFESSION,22,44,-1
сша винник предъявить обвинение отмывание деньга мошенничество криптовалюта .,винник,PERSON,6,13,-1
"россия пойти нарушение весь наш договорённость , который достигнуть таможенный союз .",россия,COUNTRY,0,6,-1
"решение суд сеул apple выплатить samsung около 35 тысяча доллар качество штраф , samsung apple — 22 тысяча доллар .",samsung,ORGANIZATION,90,97,-1
"пиночет совершить ошибка , приказать убить неруда » , — говорить арайя .",пиночет,PERSON,0,7,-1
"речь идти скандальный дело mediaset , рамка который берлускони обвиняться масштабный финансовый махинация .",берлускони,PERSON,57,67,-1
жерар депардьё решить отказаться французский гражданство,французский,COUNTRY,35,47,-1
